new_ID	PAIR	PREREQUISITE	TARGET	ID_SENT	AGREEMENT	SENT -1	SENT	SENT +1
730	PROTOCOL%INTERNET_PROTOCOL	PROTOCOL	INTERNET PROTOCOL	580	4	For example, the efficiency of user datagram protocol makes it the protocol of choice for domain name system lookups and voice over internet protocol.	However, because email is less time sensitive, mail servers use transmission control protocol to transfer email. internet protocol is the Internet's standard for implementing the tasks assigned to the network layer.	We have already observed that this task consists of forwarding, which involves relaying packets through the Internet, and routing, which involves updating the layer's forwarding table to reflect changing conditions.
731	PROTOCOL%INTERNET_PROTOCOL_ADDRESS	PROTOCOL	INTERNET PROTOCOL ADDRESS	215	1	As we learned in Section 4.1, an internet needs an internet-wide addressing system that assigns a unique identifying address to each computer in the system.	In the Internet these addresses are known as internet protocol addresses.	The term internet protocol refers to " internet protocol ", which is a term we will learn more about in Section 4.4.
732	PROTOCOL%INTERNET_PROTOCOL_NETWORK	PROTOCOL	INTERNET PROTOCOL NETWORK	342	1	The Third Generation (" 3G ") phone network provided higher data rates, allowing for mobile video calls and other bandwidth-intensive activities.	The 4G network provides even higher data rates and a fully packet-switched internet protocol network, which has allowed smartphones to enjoy the connectivity and flexibility previously available only to broadband-enabled PCs.	In order for this type of streaming to scale to thousands or even millions of simultaneous users, each with his or her own personal stream, replication of the content to many distinct servers is essential.
733	PROTOCOL%INTERNET_PROTOCOL_NETWORK_LAYER	PROTOCOL	INTERNET PROTOCOL NETWORK LAYER	586	1	This value is a limit to the number of times the packet should be forwarded as it tries to find its way through the Internet.	Each time an internet protocol network layer forwards a packet, it decrements that packet's hop count by one.	With this information, the network layer can protect the Internet from packets circling endlessly within the system.
734	PROTOCOL%MULTIPLE_ACCESS_WITH_COLLISION_DETECTION	PROTOCOL	MULTIPLE ACCESS WITH COLLISION DETECTION	43	2	Without rules governing this communication, all the computers might insist on transmitting messages at the same time or fail to assist other machines when that assistance is required.	In a bus network based on the Ethernet standards, the right to transmit messages is controlled by the protocol known as carrier sense, multiple access with collision detection (CSMA/CD).	This protocol dictates that each message be broadcast to all the machines on the bus (Figure 4.2).
735	PROTOCOL%NAME_SERVER	PROTOCOL	NAME SERVER	245	1	Thus, if a human wants to send a message to a distant machine and identifies the destination by means of a mnemonic address, the software being used must be able to convert that address into an internet protocol address before transmitting the message.	This conversion is performed with the aid of numerous servers, called name servers, that are essentially directories that provide address translation services to clients.	Collectively, these name servers are used as an Internet-wide directory system known as the domain name system (DNS).
736	PROTOCOL%NETWORK_NEWS_TRANSFER_PROTOCOL	PROTOCOL	NETWORK NEWS TRANSFER PROTOCOL	263	1	In the earlier days of the Internet, most applications were separate, simple programs that each followed a network protocol.	A newsreader application contacted servers using the Network News Transfer Protocol (NNTP), an application for listing and copying files across the network implemented the file transfer protocol (FTP), or an application for accessing another computer from a great distance used the Telnet protocol, or later the secure shell (SSH) protocol.	As webservers and browsers have become more sophisticated, more and more of these traditional network applications have come to be handled by webpages via the powerful hypertext transfer protocol (HTTP).
737	PROTOCOL%NETWORK_PROTOCOL	PROTOCOL	NETWORK PROTOCOL	265	1	As webservers and browsers have become more sophisticated, more and more of these traditional network applications have come to be handled by webpages via the powerful hypertext transfer protocol (HTTP).	Nevertheless, when examining a network protocol for an Internet application for the first time, it behooves us to begin with a few simpler examples before moving on to hypertext transfer protocol in the next section.	Electronic Mail A wide variety of systems now exist for exchanging messages between end users over the network; instant messaging (IM), browser-based online chatting, Twitter-based " tweets ", and the Facebook " wall " are but a few.
738	PROTOCOL%POST_OFFICE_PROTOCOL_VERSION_3	PROTOCOL	POST OFFICE PROTOCOL VERSION 3	300	3	There are two popular protocols that may be used for accessing email that has arrived and accumulated at a user's mail server.	These are POP3 (post office protocol version 3) and internet mail access protocol (IMAP). post office protocol version 3 (pronounced " pop-THREE ") is the simpler of the two.	Using post office protocol version 3, a user transfers (downloads) messages to his or her local computer where they can be read, stored in various folders, edited, and otherwise manipulated as the user desires.
739	PROTOCOL%PROTOCOL_STANDARD	PROTOCOL	PROTOCOL STANDARD	39	2	Such rules are called protocols.	By developing and adopting protocol standards, vendors are able to build products for network applications that are compatible with products from other vendors.	Thus, the development of protocol standards is an indispensable process in the development of networking technologies.
740	PROTOCOL%SECURE_SHELL	PROTOCOL	SECURE SHELL	263	1	In the earlier days of the Internet, most applications were separate, simple programs that each followed a network protocol.	A newsreader application contacted servers using the Network News Transfer Protocol (NNTP), an application for listing and copying files across the network implemented the file transfer protocol (FTP), or an application for accessing another computer from a great distance used the Telnet protocol, or later the secure shell (SSH) protocol.	As webservers and browsers have become more sophisticated, more and more of these traditional network applications have come to be handled by webpages via the powerful hypertext transfer protocol (HTTP).
741	PROTOCOL%SECURE_SOCKET_LAYER	PROTOCOL	SECURE SOCKET LAYER	689	1	A prime example is the secure version of hypertext transfer protocol, known as HTTPS (hypertext transfer protocol over secure socket layer), which is used by most financial institutions to provide customers with secure internet access to their accounts.	The backbone of hypertext transfer protocol over secure socket layer is the protocol system known as secure sockets layer (SSL), which was originally developed by Netscape to provide secure communication links between Web clients and servers.	Most browsers indicate the use of secure sockets layer by displaying a tiny padlock icon on the computer screen.
742	PROTOCOL%SIMPLE_MAIL_TRANSFER_PROTOCOL	PROTOCOL	SIMPLE MAIL TRANSFER PROTOCOL	268	1	One of the oldest and most enduring uses of the Internet is the electronic mail system, or email for short.	While many users now rely on their browser or a sophisticated application like Microsoft's Outlook, Apple's Mail, or Mozilla's Thunderbird to read and compose their email, the actual transmission of email messages from one computer to another on the Internet remains the domain of basic network protocols like simple mail transfer protocol.	Simple mail transfer protocol (SMTP) defines a way that two computers on the network may interact when transmitting an email message from one host to the other.
743	PROTOCOL%TRANSMISSION_CONTROL_PROTOCOL	PROTOCOL	TRANSMISSION CONTROL PROTOCOL	561	3	The transmission control protocol/internet protocol protocol suite is a collection of protocol standards used by the Internet to implement the four-level communication hierarchy.	Actually, the transmission control protocol (TCP) and the internet protocol (IP) are the names of only two of the protocols in this vast collection-so the fact that the entire collection is referred to as the transmission control protocol/internet protocol protocol suite is rather misleading.	More precisely, transmission control protocol defines a version of the transport layer.
744	PROTOCOL%TRANSMISSION_CONTROL_PROTOCOL/INTERNET_PROTOCOL_NETWORK	PROTOCOL	TRANSMISSION CONTROL PROTOCOL/INTERNET PROTOCOL NETWORK	318	1	This choice is frequently bundled with traditional Internet service and/or digital television service.	The third type of voice over internet protocol comes in the form of embedded voice over internet protocol phones, which are devices that replace a traditional telephone with an equivalent handset connected directly to a transmission control protocol/internet protocol network.	Embedded voice over internet protocol phones are becoming increasingly common for large organizations, many of whom are replacing their traditional internal copper wire telephone systems with voice over internet protocol over Ethernet to reduce costs and enhance features.
745	PROTOCOL%TRANSMISSION_CONTROL_PROTOCOL/INTERNET_PROTOCOL_PROTOCOL_SUITE	PROTOCOL	TRANSMISSION CONTROL PROTOCOL/INTERNET PROTOCOL PROTOCOL SUITE	560	2	It is an often-quoted model because it carries the authority of an international organization, but it has been slow to replace the four-level point of view, mainly because it was established after the four-level hierarchy had already become the de facto standard for the Internet.	The transmission control protocol/internet protocol protocol suite is a collection of protocol standards used by the Internet to implement the four-level communication hierarchy.	Actually, the transmission control protocol (TCP) and the internet protocol (IP) are the names of only two of the protocols in this vast collection-so the fact that the entire collection is referred to as the transmission control protocol/internet protocol protocol suite is rather misleading.
746	PROTOCOL%TRANSMISSION_CONTROL_PROTOCOL/INTERNET_PROTOCOL_SYSTEM	PROTOCOL	TRANSMISSION CONTROL PROTOCOL/INTERNET PROTOCOL SYSTEM	322	1	That is, earlier generations of wireless phones only communicated with the telephone company's network using that company's protocols.	Access to the Internet was obtained by gateways between the company's network and the Internet, at which point signals were converted to the transmission control protocol/internet protocol system.	However, the 4G phone network is an internet protocol-based network throughout, which means a 4G telephone is essentially just another broadband-connected host computer on the global Internet.
747	PROTOCOL%UNIFORM_RESOURCE_LOCATOR	PROTOCOL	UNIFORM RESOURCE LOCATOR	364	3	Thus to view a webpage, a person first provides his or her browser with the uniform resource locator of the desired document and then instructs the browser to retrieve and display the document.	A typical uniform resource locator is presented in Figure 4.8.	It consists of four segments: the protocol to use to communicate with the server controlling access to the document, the mnemonic address of the machine containing the server, the directory path needed for the server to find the directory containing the document, and the name of the document itself.
748	PROTOCOL%UNIFORM_RESOURCE_LOCATOR	PROTOCOL	UNIFORM RESOURCE LOCATOR	365	3	A typical uniform resource locator is presented in Figure 4.8.	It consists of four segments: the protocol to use to communicate with the server controlling access to the document, the mnemonic address of the machine containing the server, the directory path needed for the server to find the directory containing the document, and the name of the document itself.	In short, the uniform resource locator in Figure 4.8 tells a browser to contact the webserver on the computer known as eagle.mu.edu using the protocol hypertext transfer protocol and to retrieve the document named Julius_Caesar.html found within the subdirectory Shakespeare within the directory called authors.
749	PROTOCOL%USER_DATAGRAM_PROTOCOL	PROTOCOL	USER DATAGRAM PROTOCOL	563	2	More precisely, transmission control protocol defines a version of the transport layer.	We say a version because the transmission control protocol/internet protocol protocol suite provides for more than one way of implementing the transport layer; one of the other options is defined by the user datagram protocol (UDP).	This diversity is analogous to the fact that when shipping a package, you have a choice of different shipping companies, each of which offers the same basic service but with its own unique characteristics.
750	PROTOCOL%VOICE_OVER_INTERNET_PROTOCOL	PROTOCOL	VOICE OVER INTERNET PROTOCOL	307	1	As an example of a more recent Internet application, consider voice over internet protocol (VoIP) in which the internet infrastructure is used to provide voice communication similar to that of traditional telephone systems.	In its simplest form, voice over internet protocol consists of two processes on different machines transferring audio data via the peer-to-peer model-a process that in itself presents no significant problems.	However, tasks such as initiating and receiving calls, linking voice over internet protocol with traditional telephone systems, and providing services such as emergency 911 communication are issues that extend beyond traditional Internet applications.
751	PROTOCOL%WIFI	PROTOCOL	WIFI	57	1	The result is that wireless networks adopt the policy of trying to avoid collisions rather than trying to detect them.	Such policies are classified as carrier sense, multiple access with collision avoidance (CSMA/CA), many of which are standardized by IEEE (see the sidebar " Institute of Electrical and Electronics Engineers " in Chapter 7) within the protocols defined in IEEE 802.11 and commonly referred to as wifi.	We emphasize that collision avoidance protocols are designed to avoid collisions and may not eliminate them completely.
752	PROTOCOL%WORLD_WIDE_WEB	PROTOCOL	WORLD WIDE WEB	352	1	His first software for implementing the Web was released in December, 1990.	While this early prototype did not yet support multimedia data, it included the key components of what we now recognize as the world wide web: a hypertext document format for embedding hyperlinks to other documents; a protocol for transferring hypertext across the network, and a server process that supplied hypertext pages upon request.	From this humble beginning, the Web quickly grew to support images, audio and video, and by the mid-1990s had become the dominant application powering the growth of the Internet.
753	PROTOCOL%WORLD_WIDE_WEB_CONSORTIUM	PROTOCOL	WORLD WIDE WEB CONSORTIUM	388	1	The body contains the meat of the document, which in the case of a webpage is the material to be presented on the computer screen when the page is displayed.	The world wide web consortium The world wide web consortium (W3C) was formed in 1994 to promote the world wide web by developing protocol standards (known as world wide web consortium standards). world wide web consortium is headquartered at CERN, the high-energy particle physics laboratory in Geneva, Switzerland.	CERN is where the original hypertext markup language markup language was developed as well as the hypertext transfer protocol protocol for transferring hypertext markup language documents over the Internet.
754	PROXY_SERVER%FILE_TRANSFER_PROTOCOL_PROXY_SERVER	PROXY SERVER	FILE TRANSFER PROTOCOL PROXY SERVER	670	2	The second advantage is that the proxy server is in position to filter all the messages sent from the server to the client.	For example, an file transfer protocol proxy server could check all incoming files for the presence of known viruses and block all infected files.	Still another tool for preventing problems in a network environment is auditing software that is similar to the auditing software we learned about in our discussion on operating system security (Section 3.5).
755	PUBLIC-KEY_ENCRYPTION_SYSTEM%PRIVATE-KEY	PUBLIC-KEY ENCRYPTION SYSTEM	PRIVATE-KEY	697	2	A public-key encryption system involves the use of two values called keys.	One key, known as the public-key, is used to encrypt messages; the other key, known as the private-key, is required to decrypt messages.	To use the system, the public-key is first distributed to those who might need to send messages to a particular destination.
756	PUBLIC-KEY_ENCRYPTION_SYSTEM%PUBLIC-KEY	PUBLIC-KEY ENCRYPTION SYSTEM	PUBLIC-KEY	697	2	A public-key encryption system involves the use of two values called keys.	One key, known as the public-key, is used to encrypt messages; the other key, known as the private-key, is required to decrypt messages.	To use the system, the public-key is first distributed to those who might need to send messages to a particular destination.
757	PUBLIC-KEY_ENCRYPTION%PUBLIC-KEY_ENCRYPTION_SYSTEM	PUBLIC-KEY ENCRYPTION	PUBLIC-KEY ENCRYPTION SYSTEM	695	2	After all, intuition would suggest that if a person knows how messages are encrypted, then that person should be able to reverse the encryption process and thus decrypt messages.	But public-key encryption systems defy this intuitive logic.	A public-key encryption system involves the use of two values called keys.
758	PUBLIC-KEY%CERTIFICATE	PUBLIC-KEY	CERTIFICATE	710	3	One approach to resolving this problem is to establish trusted Internet sites, called certificate authorities, whose task is to maintain accurate lists of parties and their public-keys.	These authorities, acting as servers, then provide reliable public-key information to their clients in packages known as certificates.	A certificate is a package containing a party's name and that party's public-key.
759	PUBLIC-KEY%CERTIFICATE	PUBLIC-KEY	CERTIFICATE	711	3	These authorities, acting as servers, then provide reliable public-key information to their clients in packages known as certificates.	A certificate is a package containing a party's name and that party's public-key.	Many commercial certificate authorities are now available on the Internet, although it is also common for organizations to maintain their own certificate authorities in order to maintain tighter control over the security of the organization's communication.
760	PUBLIC-KEY%CERTIFICATE_AUTHORITY	PUBLIC-KEY	CERTIFICATE AUTHORITY	709	3	Thus, the task of associating public-keys with correct parties is significant.	One approach to resolving this problem is to establish trusted Internet sites, called certificate authorities, whose task is to maintain accurate lists of parties and their public-keys.	These authorities, acting as servers, then provide reliable public-key information to their clients in packages known as certificates.
761	PUBLIC-KEY%PUBLIC-KEY_ENCRYPTION	PUBLIC-KEY	PUBLIC-KEY ENCRYPTION	722	1	The message that is revealed is guaranteed to be authentic because only the holder of the private-key could have produced the encrypted version.	We will return to the topic of public-key encryption at the end of Chapter 12, as an example of a complex computer algorithm.	Legal Approaches to Network Security
762	PUBLIC-KEY%PUBLIC-KEY_ENCRYPTION_SYSTEM	PUBLIC-KEY	PUBLIC-KEY ENCRYPTION SYSTEM	695	2	After all, intuition would suggest that if a person knows how messages are encrypted, then that person should be able to reverse the encryption process and thus decrypt messages.	But public-key encryption systems defy this intuitive logic.	A public-key encryption system involves the use of two values called keys.
763	REMOTE_MAIL_SERVER%SIMPLE_MAIL_TRANSFER_PROTOCOL	REMOTE MAIL SERVER	SIMPLE MAIL TRANSFER PROTOCOL	275	1	Similarly, when the server process at the other end answers, the protocol states that it must identify itself to the caller.	The transcript of their simple mail transfer protocol exchange might look something like this: In line 1, the remote mail server process answers the caller by announcing its name, the protocol it speaks, and other optional information, such as the version of protocol, and the date and time.	In line 2, the sending mail server process introduces itself.
764	REPEATER%BRIDGE	REPEATER	BRIDGE	79	3	The simplest of these is the repeater, which is little more than a device that passes signals back and forth between the two original buses (usually with some form of amplification) without considering the meaning of the signals (Figure 4.4a).	A bridge is similar to, but more complex than, a repeater.	Like a repeater, it connects two buses, but it does not necessarily pass all messages across the connection.
765	REPEATER%ROUTER	REPEATER	ROUTER	98	3	The connection between networks to form an internet is handled by devices known as routers, which are special purpose computers used for forwarding messages.	Note that the task of a router is different from that of repeaters, bridges, and switches in that routers provide links between networks while allowing each network to maintain its unique internal characteristics.	As an example, Figure 4.5 depicts two wifi star networks and an Ethernet bus network connected by routers.
766	ROUTER%ADDRESS	ROUTER	ADDRESS	106	1	Thus, each machine in one of the original networks has two addresses: its original " local " address within its own network and its internet address.	A machine wanting to send a message to a machine in a distant network attaches the internet address of the destination to the message and directs the message to its local router.	From there it is forwarded in the proper direction.
767	ROUTER%FORWARDING_TABLE	ROUTER	FORWARDING TABLE	108	4	From there it is forwarded in the proper direction.	For this forwarding purpose, each router maintains a forwarding table that contains the router's knowledge about the direction in which messages should be sent depending on their destination addresses.	The " point " at which one network is linked to an internet is often called a gateway because it serves as a passageway between the network and the outside world.
768	ROUTER%GATEWAY	ROUTER	GATEWAY	111	5	Gateways can be found in a variety of forms, and thus the term is used rather loosely.	In many cases a network's gateway is merely the router through which it communicates with the rest of the internet.	In other cases the term gateway may be used to refer to more than just a router.
769	ROUTER%GATEWAY	ROUTER	GATEWAY	112	5	In many cases a network's gateway is merely the router through which it communicates with the rest of the internet.	In other cases the term gateway may be used to refer to more than just a router.	For example, in most residential wifi networks that are connected to the Internet, the term gateway refers collectively to both the network's access point and the router connected to the access point because these two devices are normally packaged in a single unit.
770	ROUTER%HOP_COUNT	ROUTER	HOP COUNT	588	2	With this information, the network layer can protect the Internet from packets circling endlessly within the system.	Although the Internet continues to grow on a daily basis, an initial hop count of 64 remains more than sufficient to allow a packet to find its way through the maze of routers within today's internet service providers.	For years a version of internet protocol known as IPv4 (internet protocol version four) has been used for implementing the network layer within the Internet.
771	ROUTER%HOT_SPOT	ROUTER	HOT SPOT	205	2	These technologies may be used to provide direct connection to an end system or to a customer's router to which multiple end systems are connected.	This latter tactic is popular for individual residences where a local hot spot is created by a router / access point connected to an access internet service provider by means of existing cable or telephone lines.	Telephone, cable television, and satellite wide area networks of the twentieth century were designed to carry analog communications, such as the human voice or pre-digital television signals.
772	ROUTER%LINK_LAYER	ROUTER	LINK LAYER	523	3	It is the network layer's job to decide in which direction a packet should be sent at each step along the packet's path through the Internet.	In fact, the combination of the network layer and the link layer below it constitutes the software residing on the Internet routers.	The network layer is in charge of maintaining the router's forwarding table and using that table to determine the direction in which to forward packets.
773	ROUTER%LINK_LAYER	ROUTER	LINK LAYER	525	3	The network layer is in charge of maintaining the router's forwarding table and using that table to determine the direction in which to forward packets.	The link layer at the router is in charge of receiving and transmitting the packets.	Thus, when the network layer at a packet's origin receives the packet from the transport layer, it uses its forwarding table to determine where the packet should be sent to get it started on its journey.
774	ROUTER%NETWORK_LAYER	ROUTER	NETWORK LAYER	523	5	It is the network layer's job to decide in which direction a packet should be sent at each step along the packet's path through the Internet.	In fact, the combination of the network layer and the link layer below it constitutes the software residing on the Internet routers.	The network layer is in charge of maintaining the router's forwarding table and using that table to determine the direction in which to forward packets.
