new_ID	PAIR	PREREQUISITE	TARGET	ID_SENT	AGREEMENT	SENT -1	SENT	SENT +1
1	ACCESS_INTERNET_SERVICE_PROVIDER%ANALOG_TELEPHONE_ADAPTER	ACCESS INTERNET SERVICE PROVIDER	ANALOG TELEPHONE ADAPTER	316	1	For instance, to receive calls, a Skype user must leave his or her PC connected to the Internet and available to the Skype system, which means that some of the PC's resources may be used to support other Skype communications without the PC owner's awareness-a feature that has generated some resistance.	A second form of voice over internet protocol consists of analog telephone adapters, which are devices that allow a user to connect his or her traditional telephone to phone service provided by an access internet service provider.	This choice is frequently bundled with traditional Internet service and/or digital television service.
2	ACCESS_INTERNET_SERVICE_PROVIDER%CONTENT_DELIVERY_NETWORK	ACCESS INTERNET SERVICE PROVIDER	CONTENT DELIVERY NETWORK	344	3	In order for this type of streaming to scale to thousands or even millions of simultaneous users, each with his or her own personal stream, replication of the content to many distinct servers is essential.	Large-scale streaming services make use of content delivery networks (CDNs), groups of servers distributed strategically around the Internet that specialize in streaming copies of content to nearby end users in their network " neighborhood ".	In many cases, content delivery networks machines may reside in an access internet service provider network, allowing customers of that access internet service provider to stream copies of multimedia content at high speed from a nearby server that is much closer in the network than the streaming service's central server machines.
3	ACCESS_INTERNET_SERVICE_PROVIDER%CONTENT_DELIVERY_NETWORK	ACCESS INTERNET SERVICE PROVIDER	CONTENT DELIVERY NETWORK	345	3	Large-scale streaming services make use of content delivery networks (CDNs), groups of servers distributed strategically around the Internet that specialize in streaming copies of content to nearby end users in their network " neighborhood ".	In many cases, content delivery networks machines may reside in an access internet service provider network, allowing customers of that access internet service provider to stream copies of multimedia content at high speed from a nearby server that is much closer in the network than the streaming service's central server machines.	A networking technology called anycast, which enables an end user to automatically connect to the closest server out of a defined group of servers, helps to make content delivery networks practical.
4	ACCESS_INTERNET_SERVICE_PROVIDER%END_SYSTEM	ACCESS INTERNET SERVICE PROVIDER	END SYSTEM	188	4	Examples include cable and telephone companies that charge for their service as well as organizations such as universities or corporations that take it upon themselves to provide internet access to individuals within their organizations.	The devices that individual users connect to the access internet service providers are known as end systems or hosts.	These end systems may be laptops or PCs, but increasingly range over a multitude of other devices including telephones, video cameras, automobiles, and home appliances.
5	ACCESS_INTERNET_SERVICE_PROVIDER%HOT_SPOT	ACCESS INTERNET SERVICE PROVIDER	HOT SPOT	205	2	These technologies may be used to provide direct connection to an end system or to a customer's router to which multiple end systems are connected.	This latter tactic is popular for individual residences where a local hot spot is created by a router / access point connected to an access internet service provider by means of existing cable or telephone lines.	Telephone, cable television, and satellite wide area networks of the twentieth century were designed to carry analog communications, such as the human voice or pre-digital television signals.
6	ACCESS_INTERNET_SERVICE_PROVIDER%INTRANET	ACCESS INTERNET SERVICE PROVIDER	INTRANET	186	2	Access to this core is usually provided by an intermediary called an access or tier-3 internet service provider.	An access internet service provider is essentially an independent internet, sometimes called an intranet, operated by a single authority that is in the business of supplying internet access to individual homes and businesses.	Examples include cable and telephone companies that charge for their service as well as organizations such as universities or corporations that take it upon themselves to provide internet access to individuals within their organizations.
7	ACCESS_INTERNET_SERVICE_PROVIDER%INTRANET	ACCESS INTERNET SERVICE PROVIDER	INTRANET	186	3	Access to this core is usually provided by an intermediary called an access or tier-3 internet service provider.	An access internet service provider is essentially an independent internet, sometimes called an intranet, operated by a single authority that is in the business of supplying internet access to individual homes and businesses.	Examples include cable and telephone companies that charge for their service as well as organizations such as universities or corporations that take it upon themselves to provide internet access to individuals within their organizations.
8	ACCESS_INTERNET_SERVICE_PROVIDER%REGISTERED_DOMAIN	ACCESS INTERNET SERVICE PROVIDER	REGISTERED DOMAIN	257	1	For example, it might be beneficial for a local chess club to have a presence on the Internet as KingsandQueens.org, but the club would likely not have the resources to establish its own network, maintain a link from this network to the Internet, and implement its own name server.	In this case, the club can contract with an access internet service provider to create the appearance of a registered domain using the resources already established by the internet service provider.	Typically, the club, perhaps with the assistance of the internet service provider, registers the name chosen by the club and contracts with the internet service provider to have that name included in the internet service provider's name server.
9	ACCESS_POINT%ACCESS_INTERNET_SERVICE_PROVIDER	ACCESS POINT	ACCESS INTERNET SERVICE PROVIDER	193	1	Perhaps the fastest growing are wireless connections based on wifi technology.	The strategy is to connect the access point to an access internet service provider and thus provide internet access through that internet service provider to end systems within the access point's broadcast range.	The area within the access point or group of access points' range is often called a hot spot, particularly when the network access is publicly available or free.
10	ACCESS_POINT%GATEWAY	ACCESS POINT	GATEWAY	113	4	In other cases the term gateway may be used to refer to more than just a router.	For example, in most residential wifi networks that are connected to the Internet, the term gateway refers collectively to both the network's access point and the router connected to the access point because these two devices are normally packaged in a single unit.	Methods of Process Communication
11	ACCESS_POINT%HOT_SPOT	ACCESS POINT	HOT SPOT	194	5	The strategy is to connect the access point to an access internet service provider and thus provide internet access through that internet service provider to end systems within the access point's broadcast range.	The area within the access point or group of access points' range is often called a hot spot, particularly when the network access is publicly available or free.	Hot spots can be found in individual residences, hotel and office buildings, small businesses, parks, and in some cases span entire cities.
12	ACCESS_POINT%HOT_SPOT	ACCESS POINT	HOT SPOT	205	5	These technologies may be used to provide direct connection to an end system or to a customer's router to which multiple end systems are connected.	This latter tactic is popular for individual residences where a local hot spot is created by a router / access point connected to an access internet service provider by means of existing cable or telephone lines.	Telephone, cable television, and satellite wide area networks of the twentieth century were designed to carry analog communications, such as the human voice or pre-digital television signals.
13	ACCESS_POINT%ROUTER	ACCESS POINT	ROUTER	101	1	When a machine in one of the wifi networks wants to send a message to a machine in the ethernet network, it first sends the message to the access point in its network.	From there, the access point sends the message to its associated router, and this router forwards the message to the router at the Ethernet.	There the message is given to a machine on the bus, and that machine then forwards the message to its final destination in the Ethernet.
14	ACCESS_POINT%STAR	ACCESS POINT	STAR	28	1	As the simple terminals employed by these users grew into small computers themselves, a star network emerged.	Today, the star configuration is popular in wireless networks where communication is conducted by means of radio broadcast and the central machine, called the access point (AP), serves as a focal point around which all communication is coordinated.	The difference between a bus network and a star network is not always obvious by the physical arrangement of equipment.
15	ACCESS_POINT%WIFI_NETWORK	ACCESS POINT	WIFI NETWORK	69	1	After all, any protocol based on distinguishing between a silent or busy channel requires that each individual station be able to hear all the others.	To solve this problem, some wifi networks require that each machine send a short " request " message to the access point and wait until the access point acknowledges that request before transmitting an entire message.	If the access point is busy because it is dealing with a " hidden terminal ", it will ignore the request, and the requesting machine will know to wait.
16	ADDRESS_TRANSLATION_SERVICE%DOMAIN_NAME_SYSTEM_LOOKUP	ADDRESS TRANSLATION SERVICE	DOMAIN NAME SYSTEM LOOKUP	247	1	Collectively, these name servers are used as an Internet-wide directory system known as the domain name system (DNS).	The process of using domain name system to perform a translation is called a domain name system lookup.	Thus, for a machine to be accessible by means of a mnemonic domain name, that name must be represented in a name server within the domain name system.
17	ADDRESSING_SYSTEM%DOMAIN	ADDRESSING SYSTEM	DOMAIN	225	2	For this reason the Internet has an alternative addressing system in which machines are identified by mnemonic names.	This addressing system is based on the concept of a domain, which can be thought of as a " region " of the Internet operated by a single authority such as a university, club, company, or government agency.	The word region is in quotations here because, as we will soon see, such a region may not correspond to a physical area of the Internet.
18	ADDRESSING_SYSTEM%FORWARDING_TABLE	ADDRESSING SYSTEM	FORWARDING TABLE	108	1	From there it is forwarded in the proper direction.	For this forwarding purpose, each router maintains a forwarding table that contains the router's knowledge about the direction in which messages should be sent depending on their destination addresses.	The " point " at which one network is linked to an internet is often called a gateway because it serves as a passageway between the network and the outside world.
19	ADDRESSING_SYSTEM%INTERNET_PROTOCOL_ADDRESS	ADDRESSING SYSTEM	INTERNET PROTOCOL ADDRESS	215	2	As we learned in Section 4.1, an internet needs an internet-wide addressing system that assigns a unique identifying address to each computer in the system.	In the Internet these addresses are known as internet protocol addresses.	The term internet protocol refers to " internet protocol ", which is a term we will learn more about in Section 4.4.
20	ADDRESSING_SYSTEM%INTERNET_PROTOCOL_ADDRESS	ADDRESSING SYSTEM	INTERNET PROTOCOL ADDRESS	215	3	As we learned in Section 4.1, an internet needs an internet-wide addressing system that assigns a unique identifying address to each computer in the system.	In the Internet these addresses are known as internet protocol addresses.	The term internet protocol refers to " internet protocol ", which is a term we will learn more about in Section 4.4.
21	ADDRESSING_SYSTEM%INTERNET_PROTOCOL_VERSION_FOUR	ADDRESSING SYSTEM	INTERNET PROTOCOL VERSION FOUR	590	1	For years a version of internet protocol known as IPv4 (internet protocol version four) has been used for implementing the network layer within the Internet.	However, the Internet is rapidly outgrowing the 32-bit internet addressing system dictated by internet protocol version four.	To solve this problem as well as to implement other improvements such as multicast, a new version of internet protocol known as IPv6 (internet protocol version six), which uses internet addresses consisting of 128 bits, has been established.
22	ADDRESSING_SYSTEM%IPv4	ADDRESSING SYSTEM	IPv4	590	1	For years a version of internet protocol known as IPv4 (internet protocol version four) has been used for implementing the network layer within the Internet.	However, the Internet is rapidly outgrowing the 32-bit internet addressing system dictated by internet protocol version four.	To solve this problem as well as to implement other improvements such as multicast, a new version of internet protocol known as IPv6 (internet protocol version six), which uses internet addresses consisting of 128 bits, has been established.
23	ADDRESSING_SYSTEM%IPV6	ADDRESSING SYSTEM	IPV6	591	1	However, the Internet is rapidly outgrowing the 32-bit internet addressing system dictated by internet protocol version four.	To solve this problem as well as to implement other improvements such as multicast, a new version of internet protocol known as IPv6 (internet protocol version six), which uses internet addresses consisting of 128 bits, has been established.	The process of converting from internet protocol version four to internet protocol version six is currently underway-this is the conversion that was alluded to in our introduction of Internet addresses in Section 4.2-and it is expected that the use of 32-bit addresses within the Internet will be extinct by 2025.
24	ANALOG_COMMUNICATION%ANALOG_NETWORK_INFRASTRUCTURE	ANALOG COMMUNICATION	ANALOG NETWORK INFRASTRUCTURE	207	1	Telephone, cable television, and satellite wide area networks of the twentieth century were designed to carry analog communications, such as the human voice or pre-digital television signals.	Modern networks can be designed to carry digital data directly between computers, but older, analog network infrastructure still comprises a significant portion of the Internet.	Issues arising from these legacy analog linkages are often referred to collectively as the last mile problem.
25	ANALOG_NETWORK_INFRASTRUCTURE%LEGACY_ANALOG_LINKAGE	ANALOG NETWORK INFRASTRUCTURE	LEGACY ANALOG LINKAGE	208	1	Modern networks can be designed to carry digital data directly between computers, but older, analog network infrastructure still comprises a significant portion of the Internet.	Issues arising from these legacy analog linkages are often referred to collectively as the last mile problem.	The main arteries of wide area networks, metropolitan area networks, and many local area networks are relatively easy to modernize with high-speed digital technology such as fiber optics, but it can be far costlier to replace the existing copper telephone lines and coaxial cables that connect these arteries to each individual home or office.
26	ANALOG_NETWORK%LAST_MILE_PROBLEM	ANALOG NETWORK	LAST MILE PROBLEM	208	1	Modern networks can be designed to carry digital data directly between computers, but older, analog network infrastructure still comprises a significant portion of the Internet.	Issues arising from these legacy analog linkages are often referred to collectively as the last mile problem.	The main arteries of wide area networks, metropolitan area networks, and many local area networks are relatively easy to modernize with high-speed digital technology such as fiber optics, but it can be far costlier to replace the existing copper telephone lines and coaxial cables that connect these arteries to each individual home or office.
27	ANALOG_VOICE_SIGNAL%1G	ANALOG VOICE SIGNAL	1G	332	1	The first generation wireless telephone network transmitted analog voice signals through the air, much like traditional telephones but without the copper wire running into the wall.	In retrospect, we call these early phones " 1G ", or first generation.	The second generation used digital signals to encode voice, providing more effective use of the airwaves, and the transmission of other kinds of digital data, like text messaging.
28	APPLICATION_LAYER%PORT_NUMBER	APPLICATION LAYER	PORT NUMBER	544	2	Determining which unit within the application layer should receive an incoming message is an important task of the transport layer.	This is handled by assigning unique port numbers (not related to the I/O ports discussed in Chapter 2) to the various units and requiring that the appropriate port number be appended to a message's address before starting the message on its journey.	Then, once the message is received by the transport layer at the destination, the transport layer merely hands the message to the application layer software at the designated port number.
29	APPLICATION_LAYER%PORT_NUMBER	APPLICATION LAYER	PORT NUMBER	545	2	This is handled by assigning unique port numbers (not related to the I/O ports discussed in Chapter 2) to the various units and requiring that the appropriate port number be appended to a message's address before starting the message on its journey.	Then, once the message is received by the transport layer at the destination, the transport layer merely hands the message to the application layer software at the designated port number.	Users of the Internet rarely need to be concerned with port numbers because the common applications have universally accepted port numbers.
30	APPLICATION_LAYER%TRANSMISSION_CONTROL_PROTOCOL	APPLICATION LAYER	TRANSMISSION CONTROL PROTOCOL	565	1	This diversity is analogous to the fact that when shipping a package, you have a choice of different shipping companies, each of which offers the same basic service but with its own unique characteristics.	Thus, depending on the particular quality of service required, a unit within the application layer might choose to send data via a transmission control protocol or user datagram protocol version of the transport layer (Figure 4.15).	There are several differences between transmission control protocol and user datagram protocol.
31	APPLICATION_LAYER%TRANSPORT_LAYER	APPLICATION LAYER	TRANSPORT LAYER	511	3	For example, software for transferring files using file transfer protocol or for providing remote login capabilities using secure shell have become so common that they are normally considered utility software.	The application layer uses the transport layer to send and receive messages over the Internet in much the same way that you would use a shipping company to send and receive packages.	Just as it is your responsibility to provide an address compatible with the specifications of the shipping company, it is the application layer's responsibility to provide an address that is compatible with the internet infrastructure.
32	APPLICATION_LAYER%TRANSPORT_LAYER	APPLICATION LAYER	TRANSPORT LAYER	514	3	To fulfill this need, the application layer may use the services of the name servers within the Internet to translate mnemonic addresses used by humans into Internet-compatible internet protocol addresses.	An important task of the transport layer is to accept messages from the application layer and to ensure that the messages are properly formatted for transmission over the Internet.	Toward this latter goal, the transport layer divides long messages into small segments, which are transmitted over the Internet as individual units.
33	APPLICATION_LAYER%USER_DATAGRAM_PROTOCOL	APPLICATION LAYER	USER DATAGRAM PROTOCOL	565	1	This diversity is analogous to the fact that when shipping a package, you have a choice of different shipping companies, each of which offers the same basic service but with its own unique characteristics.	Thus, depending on the particular quality of service required, a unit within the application layer might choose to send data via a transmission control protocol or user datagram protocol version of the transport layer (Figure 4.15).	There are several differences between transmission control protocol and user datagram protocol.
34	APPLICATION%APPLICATION_LAYER	APPLICATION	APPLICATION LAYER	550	1	In summary, communication over the Internet involves the interaction of four layers of software.	The application layer deals with messages from the application's point of view.	The transport layer converts these messages into segments that are compatible with the Internet and reassembles messages that are received before delivering them to the appropriate application.
35	ASCII_CHARACTER%INTERNET_PROTOCOL	ASCII CHARACTER	INTERNET PROTOCOL	278	1	In line 3, the remote server acknowledges the name of the sending server.	Most internet protocols are not necessarily transmitted in ASCII characters so easily interpreted by a human.	To be sure, the quaint politeness of " pleased to meet you " in line 3 is neither appreciated by the software on either end of this connection, nor essential to simple mail transfer protocol's proper function.
36	ASCII_CHARACTER%MULTIPURPOSE_INTERNET_MAIL_EXTENSION	ASCII CHARACTER	MULTIPURPOSE INTERNET MAIL EXTENSION	298	1	Other protocols come into play for other aspects of transporting email.	Because simple mail transfer protocol was initially designed for transferring text messages encoded with ASCII, additional protocols such as multipurpose internet mail extension (MIME) have been developed to convert non-ASCII data to simple mail transfer protocol compatible form.	There are two popular protocols that may be used for accessing email that has arrived and accumulated at a user's mail server.
37	ASCII%HYPERTEXT_DOCUMENT	ASCII	HYPERTEXT DOCUMENT	376	1	hypertext markup language	A traditional hypertext document is similar to a text file because its text is encoded character by character using a system such as ASCII or Unicode.	The distinction is that a hypertext document also contains special symbols, called tags, that describe how the document should appear on a display screen, what multimedia resources (such as images) should accompany the document, and which items within the document are linked to other documents.
38	AUDITING_SOFTWARE%FIREWALL	AUDITING SOFTWARE	FIREWALL	672	1	Still another tool for preventing problems in a network environment is auditing software that is similar to the auditing software we learned about in our discussion on operating system security (Section 3.5).	Using network auditing software, a system administrator can detect a sudden increase in message traffic at various locations within the administrator's realm, monitor the activities of the system's firewalls, and analyze the pattern of requests being made by the individual computers in order to detect irregularities.	In effect, auditing software is an administrator's primary tool for identifying problems before they grow out of control.
39	BIT_PATTERN%128-BIT_ADDRESS	BIT PATTERN	128-BIT ADDRESS	217	1	The term internet protocol refers to " internet protocol ", which is a term we will learn more about in Section 4.4.	Originally, each internet protocol address was a pattern of 32 bits, but to provide a larger set of addresses, the process of converting to 128-bit addresses is currently underway (see the discussion of internet protocolv6 in Section 4.4).	Blocks of consecutively numbered internet protocol addresses are awarded to internet service providers by the Internet Corporation for Assigned Names and Numbers (ICANN), which is a nonprofit corporation established to coordinate the Internet's operation.
40	BIT_PATTERN%32-BIT_INTERNET_PROTOCOL_ADDRESS	BIT PATTERN	32-BIT INTERNET PROTOCOL ADDRESS	222	1	For example, using dotted decimal notation, the pattern 5.2 would represent the two-byte bit pattern 0000010100000010, which consists of the byte 00000101 (represented by 5) followed by the byte 00000010 (represented by 2), and the pattern 17.12.25 would represent the three-byte bit pattern consisting of the byte 00010001 (which is 17 written in binary notation), followed by the byte 00001100 (12 written in binary), followed by the byte 00011001 (25 written in binary).	In summary, a 32-bit internet protocol address might appear as 192.207.177.133 when expressed in dotted decimal notation.	Addresses in bit-pattern form (even when compressed using dotted decimal notation) are rarely conducive to human consumption.
41	BIT_PATTERN%DIGITAL_SIGNATURE	BIT PATTERN	DIGITAL SIGNATURE	716	4	That is, text can be encrypted with the private-key, and because only one party has access to that key, any text that is so encrypted must have originated from that party.	In this manner, the holder of the private-key can produce a bit pattern, called a digital signature, that only that party knows how to produce.	By attaching that signature to a message, the sender can mark the message as being authentic.
