new_ID	PAIR	PREREQUISITE	TARGET	ID_SENT	AGREEMENT	SENT -1	SENT	SENT +1
453	LOCAL_MACHINE%POST_OFFICE_PROTOCOL_VERSION_3	LOCAL MACHINE	POST OFFICE PROTOCOL VERSION 3	300	4	There are two popular protocols that may be used for accessing email that has arrived and accumulated at a user's mail server.	These are POP3 (post office protocol version 3) and internet mail access protocol (IMAP). post office protocol version 3 (pronounced " pop-THREE ") is the simpler of the two.	Using post office protocol version 3, a user transfers (downloads) messages to his or her local computer where they can be read, stored in various folders, edited, and otherwise manipulated as the user desires.
454	LOCAL_MACHINE%POST_OFFICE_PROTOCOL_VERSION_3	LOCAL MACHINE	POST OFFICE PROTOCOL VERSION 3	301	4	These are POP3 (post office protocol version 3) and internet mail access protocol (IMAP). post office protocol version 3 (pronounced " pop-THREE ") is the simpler of the two.	Using post office protocol version 3, a user transfers (downloads) messages to his or her local computer where they can be read, stored in various folders, edited, and otherwise manipulated as the user desires.	This is done on the user's local machine using the local machine's mass storage.
455	MACHINE%ACCESS_POINT	MACHINE	ACCESS POINT	28	4	As the simple terminals employed by these users grew into small computers themselves, a star network emerged.	Today, the star configuration is popular in wireless networks where communication is conducted by means of radio broadcast and the central machine, called the access point (AP), serves as a focal point around which all communication is coordinated.	The difference between a bus network and a star network is not always obvious by the physical arrangement of equipment.
456	MACHINE%BUS	MACHINE	BUS	23	3	Still another way of classifying networks is based on the topology of the network, which refers to the pattern in which the machines are connected.	Two of the more popular topologies are the bus, in which the machines are all connected to a common communication line called a bus (Figure 4.1a), and the star, in which one machine serves as a central focal point to which all the others are connected (Figure 4.1b).	The bus topology was popularized in the 1990s when it was implemented under a set of standards known as Ethernet, and ethernet networks remain one of the most popular networking systems in use today.
457	MACHINE%COLLISION_AVOIDANCE	MACHINE	COLLISION AVOIDANCE	60	1	When collisions do occur, messages must be retransmitted.	The most common approach to collision avoidance is based on giving advantage to machines that have already been waiting for an opportunity to transmit.	The protocol used is similar to Ethernet's carrier sense, multiple access with collision detection.
458	MACHINE%CONTENT_DELIVERY_NETWORK	MACHINE	CONTENT DELIVERY NETWORK	345	1	Large-scale streaming services make use of content delivery networks (CDNs), groups of servers distributed strategically around the Internet that specialize in streaming copies of content to nearby end users in their network " neighborhood ".	In many cases, content delivery networks machines may reside in an access internet service provider network, allowing customers of that access internet service provider to stream copies of multimedia content at high speed from a nearby server that is much closer in the network than the streaming service's central server machines.	A networking technology called anycast, which enables an end user to automatically connect to the closest server out of a defined group of servers, helps to make content delivery networks practical.
459	MACHINE%DISTRIBUTED_SYSTEM	MACHINE	DISTRIBUTED SYSTEM	152	1	Several types of distributed computing systems are now common.	Cluster computing describes a distributed system in which many independent computers work closely together to provide computation or services comparable to a much larger machine.	The cost of these individual machines, plus the high-speed network to connect them, can be less than a higher-priced supercomputer, but with higher reliability and lower maintenance costs.
460	MACHINE%FILE_SERVER	MACHINE	FILE SERVER	125	1	Other machines on the network then requested access to the records as they needed them.	Thus the machine that actually contained the records played the role of a server (called a file server), and the other machines played the role of clients that requested access to the files that were stored at the file server.	Today the client/server model is used extensively in network applications, as we will see later in this chapter.
461	MACHINE%HIDDEN_TERMINAL_PROBLEM	MACHINE	HIDDEN TERMINAL PROBLEM	55	2	For example, the machine may not hear the other because its own signal drowns out that of the other machine.	Another cause might be that the signals from the different machines are blocked from each other by objects or distance even though they can all communicate with the central access point (a condition known as the hidden terminal problem, Figure 4.3).	The result is that wireless networks adopt the policy of trying to avoid collisions rather than trying to detect them.
462	MACHINE%LOCAL_MACHINE	MACHINE	LOCAL MACHINE	302	1	Using post office protocol version 3, a user transfers (downloads) messages to his or her local computer where they can be read, stored in various folders, edited, and otherwise manipulated as the user desires.	This is done on the user's local machine using the local machine's mass storage.	internet mail access protocol (pronounced " EYE-map ") allows a user to store and manipulate messages and related materials on the same machine as the mail server.
463	MACHINE%NETWORK	MACHINE	NETWORK	22	1	In contrast, a company such as Novell Inc. might develop proprietary systems for which it chooses to maintain ownership rights, allowing the company to draw income from selling or leasing these products.	Still another way of classifying networks is based on the topology of the network, which refers to the pattern in which the machines are connected.	Two of the more popular topologies are the bus, in which the machines are all connected to a common communication line called a bus (Figure 4.1a), and the star, in which one machine serves as a central focal point to which all the others are connected (Figure 4.1b).
464	MACHINE%PROTOCOL	MACHINE	PROTOCOL	41	1	Thus, the development of protocol standards is an indispensable process in the development of networking technologies.	As an introduction to the protocol concept, let us consider the problem of coordinating the transmission of messages among computers in a network.	Without rules governing this communication, all the computers might insist on transmitting messages at the same time or fail to assist other machines when that assistance is required.
465	MACHINE%SERVER	MACHINE	SERVER	117	2	Such communication between processes is called interprocess communication.	A popular convention used for interprocess communication is the client / server model.	This model defines the basic roles played by the processes as either a client, which makes requests of other processes, or a server, which satisfies the requests made by clients.
466	MACHINE%SILENT_CHANNEL	MACHINE	SILENT CHANNEL	65	1	If a busy channel is experienced during this process, the machine waits for a randomly determined period before trying again.	Once this period is exhausted, the machine is allowed to claim a silent channel without hesitation.	This means that collisions between " newcomers " and those that have already been waiting are avoided because a " newcomer " is not allowed to claim a silent channel until any machine that has been waiting is given the opportunity to start.
467	MACHINE%STAR	MACHINE	STAR	23	2	Still another way of classifying networks is based on the topology of the network, which refers to the pattern in which the machines are connected.	Two of the more popular topologies are the bus, in which the machines are all connected to a common communication line called a bus (Figure 4.1a), and the star, in which one machine serves as a central focal point to which all the others are connected (Figure 4.1b).	The bus topology was popularized in the 1990s when it was implemented under a set of standards known as Ethernet, and ethernet networks remain one of the most popular networking systems in use today.
468	MACHINE%UNIFORM_RESOURCE_LOCATOR	MACHINE	UNIFORM RESOURCE LOCATOR	364	1	Thus to view a webpage, a person first provides his or her browser with the uniform resource locator of the desired document and then instructs the browser to retrieve and display the document.	A typical uniform resource locator is presented in Figure 4.8.	It consists of four segments: the protocol to use to communicate with the server controlling access to the document, the mnemonic address of the machine containing the server, the directory path needed for the server to find the directory containing the document, and the name of the document itself.
469	MACHINE%VIRUS	MACHINE	VIRUS	606	1	The Computer Emergency Response Team Coordination Center maintains a website at http://www.cert.org where it posts notices of its activities.	A virus is software that infects a computer by inserting itself into programs that already reside in the machine.	Then, when the " host " program is executed, the virus is also executed.
470	MACHINE%VOICE_OVER_INTERNET_PROTOCOL	MACHINE	VOICE OVER INTERNET PROTOCOL	306	1	VoIP	As an example of a more recent Internet application, consider voice over internet protocol (VoIP) in which the internet infrastructure is used to provide voice communication similar to that of traditional telephone systems.	In its simplest form, voice over internet protocol consists of two processes on different machines transferring audio data via the peer-to-peer model-a process that in itself presents no significant problems.
471	MACHINE%WIDE_AREA_NETWORK	MACHINE	WIDE AREA NETWORK	14	2	A metropolitan area network is a network of intermediate size, such as one spanning a local community.	Finally, a wide area network links machines over a greater distance-perhaps in neighboring cities or on opposite sides of the world.	Another means of classifying networks is based on whether the network's internal operation is based on designs that are in the public domain or on innovations owned and controlled by a particular entity such as an individual or a corporation.
472	MAGNETIC_DISK%MASS_STORAGE	MAGNETIC DISK	MASS STORAGE	123	2	Another early application of the client/server model was used to reduce the cost of magnetic disk storage while also removing the need for duplicate copies of records.	Here one machine in a network was equipped with a high-capacity mass storage system (usually a magnetic disk) that contained all of an organization's records.	Other machines on the network then requested access to the records as they needed them.
473	MAIL_SERVER%DOMAIN_NAME_SYSTEM	MAIL SERVER	DOMAIN NAME SYSTEM	272	1	First, a mail handling process on mail.skaro.gov contacts the mail server process on mail.tardis.edu.	To accomplish this, it uses domain name system, another network protocol, to map the human-readable destination domain name to the proper mail server name, and then to its internet protocol address.	This is not unlike looking up the phone number of an acquaintance before dialing.
474	MAIL_SERVER%END_USER	MAIL SERVER	END USER	270	1	Simple mail transfer protocol (SMTP) defines a way that two computers on the network may interact when transmitting an email message from one host to the other.	Consider the example case of a mail server mail.skaro.gov sending an email from end user " dalek " to end user " doctor " in the domain tardis.edu.	First, a mail handling process on mail.skaro.gov contacts the mail server process on mail.tardis.edu.
475	MAIL_SERVER%INTERNET_MAIL_ACCESS_PROTOCOL	MAIL SERVER	INTERNET MAIL ACCESS PROTOCOL	300	4	There are two popular protocols that may be used for accessing email that has arrived and accumulated at a user's mail server.	These are POP3 (post office protocol version 3) and internet mail access protocol (IMAP). post office protocol version 3 (pronounced " pop-THREE ") is the simpler of the two.	Using post office protocol version 3, a user transfers (downloads) messages to his or her local computer where they can be read, stored in various folders, edited, and otherwise manipulated as the user desires.
476	MAIL_SERVER%INTERNET_MAIL_ACCESS_PROTOCOL	MAIL SERVER	INTERNET MAIL ACCESS PROTOCOL	303	5	This is done on the user's local machine using the local machine's mass storage.	internet mail access protocol (pronounced " EYE-map ") allows a user to store and manipulate messages and related materials on the same machine as the mail server.	In this manner, a user who must access his or her email from different computers can maintain records at the mail server that are then accessible from any remote computer to which the user may have access.
477	MAIL_SERVER%PORT_NUMBER	MAIL SERVER	PORT NUMBER	548	1	For example, if a Web browser is asked to retrieve the document whose uniform resource locator is http://www .zoo.org/animals/frog.html, the browser assumes that it should contact the hypertext transfer protocol server at www.zoo.org via port number 80.	Likewise, when sending email, an simple mail transfer protocol client assumes that it should communicate with the simple mail transfer protocol mail server through port number 25.	In summary, communication over the Internet involves the interaction of four layers of software.
478	MAIL_SERVER%POST_OFFICE_PROTOCOL_VERSION_3	MAIL SERVER	POST OFFICE PROTOCOL VERSION 3	300	2	There are two popular protocols that may be used for accessing email that has arrived and accumulated at a user's mail server.	These are POP3 (post office protocol version 3) and internet mail access protocol (IMAP). post office protocol version 3 (pronounced " pop-THREE ") is the simpler of the two.	Using post office protocol version 3, a user transfers (downloads) messages to his or her local computer where they can be read, stored in various folders, edited, and otherwise manipulated as the user desires.
479	MAIL_SERVER%POST_OFFICE_PROTOCOL_VERSION_3	MAIL SERVER	POST OFFICE PROTOCOL VERSION 3	300	3	There are two popular protocols that may be used for accessing email that has arrived and accumulated at a user's mail server.	These are POP3 (post office protocol version 3) and internet mail access protocol (IMAP). post office protocol version 3 (pronounced " pop-THREE ") is the simpler of the two.	Using post office protocol version 3, a user transfers (downloads) messages to his or her local computer where they can be read, stored in various folders, edited, and otherwise manipulated as the user desires.
480	MAIL_SERVER%SERVER-SIDE_ACTIVITY	MAIL SERVER	SERVER-SIDE ACTIVITY	466	1	In this case, the webserver is an intermediary between the client and the client's mail server.	Essentially, the webserver builds webpages that contain information from the mail server (a server-side activity) and sends those pages to the client where the client's browser displays them (a client-side activity).	Conversely, the browser allows the user to create messages (a client-side activity) and sends that information to the webserver, which then forwards the messages to the mail server (a server-side activity) for mailing.
481	MAIL_SERVER%SIMPLE_MAIL_TRANSFER_PROTOCOL	MAIL SERVER	SIMPLE MAIL TRANSFER PROTOCOL	269	1	While many users now rely on their browser or a sophisticated application like Microsoft's Outlook, Apple's Mail, or Mozilla's Thunderbird to read and compose their email, the actual transmission of email messages from one computer to another on the Internet remains the domain of basic network protocols like simple mail transfer protocol.	Simple mail transfer protocol (SMTP) defines a way that two computers on the network may interact when transmitting an email message from one host to the other.	Consider the example case of a mail server mail.skaro.gov sending an email from end user " dalek " to end user " doctor " in the domain tardis.edu.
482	MAIL_SERVER%TRANSMISSION_CONTROL_PROTOCOL	MAIL SERVER	TRANSMISSION CONTROL PROTOCOL	580	2	For example, the efficiency of user datagram protocol makes it the protocol of choice for domain name system lookups and voice over internet protocol.	However, because email is less time sensitive, mail servers use transmission control protocol to transfer email. internet protocol is the Internet's standard for implementing the tasks assigned to the network layer.	We have already observed that this task consists of forwarding, which involves relaying packets through the Internet, and routing, which involves updating the layer's forwarding table to reflect changing conditions.
483	MALICIOUS_SOFTWARE%ANTIVIRUS_SOFTWARE	MALICIOUS SOFTWARE	ANTIVIRUS SOFTWARE	674	1	In effect, auditing software is an administrator's primary tool for identifying problems before they grow out of control.	Another means of defense against invasions via network connections is software called antivirus software, which is used to detect and remove the presence of known viruses and other infections.	Actually, antivirus software represents a broad class of software products, each designed to detect and remove a specific type of infection.
484	MALICIOUS_SOFTWARE%AUDITING_SOFTWARE	MALICIOUS SOFTWARE	AUDITING SOFTWARE	671	1	For example, an file transfer protocol proxy server could check all incoming files for the presence of known viruses and block all infected files.	Still another tool for preventing problems in a network environment is auditing software that is similar to the auditing software we learned about in our discussion on operating system security (Section 3.5).	Using network auditing software, a system administrator can detect a sudden increase in message traffic at various locations within the administrator's realm, monitor the activities of the system's firewalls, and analyze the pattern of requests being made by the individual computers in order to detect irregularities.
485	MALICIOUS_SOFTWARE%FIREWALL	MALICIOUS SOFTWARE	FIREWALL	644	1	The old adage " an ounce of prevention is worth a pound of cure " is certainly true in the context of controlling vandalism over network connections.	A primary prevention technique is to filter traffic passing through a point in the network, usually with a program called a firewall.	For instance, a firewall might be installed at the gateway of an organization's intranet to filter messages passing in and out of the region.
486	MALICIOUS_SOFTWARE%PHISHING	MALICIOUS SOFTWARE	PHISHING	623	1	In other cases, spyware is used for blatantly malicious purposes such as recording the symbol sequences typed at the computer's keyboard in search of passwords or credit card numbers.	As opposed to obtaining information secretly by sniffing via spyware, phishing is a technique of obtaining information explicitly by simply asking for it.	The term phishing is a play on the word fishing because the process involved is to cast numerous " lines " in hopes that someone will " take the bait ".
487	MALICIOUS_SOFTWARE%PROXY_SERVER	MALICIOUS SOFTWARE	PROXY SERVER	659	1	These filters are examples of how a variety of subject areas (probability theory, artificial intelligence, etc.) can jointly contribute to developments in other fields.	Another preventative tool that has filtering connotations is the proxy server.	A proxy server is a software unit that acts as an intermediary between a client and a server with the goal of shielding the client from adverse actions of the server.
488	MALICIOUS_SOFTWARE%SPYWARE	MALICIOUS SOFTWARE	SPYWARE	600	5	Such software might be transferred to, and executed on, the computer itself, or it might attack the computer from a distance.	Examples of software that is transferred to, and executed on, the computer under attack include viruses, worms, trojan horses, and spyware, whose names reflect the primary characteristic of the software.	The Computer Emergency Response Team In November 1988 a worm released into the Internet caused significant disruption of service.
489	MALICIOUS_SOFTWARE%SPYWARE	MALICIOUS SOFTWARE	SPYWARE	620	5	Thus, email attachments from unknown sources should never be opened.	Another form of malicious software is spyware (sometimes called sniffing software), which is software that collects information about activities at the computer on which it resides and reports that information back to the instigator of the attack.	Some companies use spyware as a means of building customer profiles, and in this context, it has questionable ethical merit.
490	MALICIOUS_SOFTWARE%TROJAN_HORSE	MALICIOUS SOFTWARE	TROJAN HORSE	600	3	Such software might be transferred to, and executed on, the computer itself, or it might attack the computer from a distance.	Examples of software that is transferred to, and executed on, the computer under attack include viruses, worms, trojan horses, and spyware, whose names reflect the primary characteristic of the software.	The Computer Emergency Response Team In November 1988 a worm released into the Internet caused significant disruption of service.
491	MALICIOUS_SOFTWARE%TROJAN_HORSE	MALICIOUS SOFTWARE	TROJAN HORSE	600	4	Such software might be transferred to, and executed on, the computer itself, or it might attack the computer from a distance.	Examples of software that is transferred to, and executed on, the computer under attack include viruses, worms, trojan horses, and spyware, whose names reflect the primary characteristic of the software.	The Computer Emergency Response Team In November 1988 a worm released into the Internet caused significant disruption of service.
492	MALICIOUS_SOFTWARE%TROJAN_HORSE	MALICIOUS SOFTWARE	TROJAN HORSE	613	4	A characteristic consequence of a worm is an explosion of the worm's replicated copies that degrades the performance of legitimate applications and can ultimately overload an entire network or internet.	A trojan horse is a program that enters a computer system disguised as a desirable program, such as a game or useful utility package, that is willingly imported by the victim.	Once in the computer, however, the trojan horse performs additional activities that might have harmful effects.
493	MALICIOUS_SOFTWARE%VIRUS	MALICIOUS SOFTWARE	VIRUS	600	3	Such software might be transferred to, and executed on, the computer itself, or it might attack the computer from a distance.	Examples of software that is transferred to, and executed on, the computer under attack include viruses, worms, trojan horses, and spyware, whose names reflect the primary characteristic of the software.	The Computer Emergency Response Team In November 1988 a worm released into the Internet caused significant disruption of service.
494	MALICIOUS_SOFTWARE%VIRUS	MALICIOUS SOFTWARE	VIRUS	606	3	The Computer Emergency Response Team Coordination Center maintains a website at http://www.cert.org where it posts notices of its activities.	A virus is software that infects a computer by inserting itself into programs that already reside in the machine.	Then, when the " host " program is executed, the virus is also executed.
495	MALICIOUS_SOFTWARE%WORM	MALICIOUS SOFTWARE	WORM	600	4	Such software might be transferred to, and executed on, the computer itself, or it might attack the computer from a distance.	Examples of software that is transferred to, and executed on, the computer under attack include viruses, worms, trojan horses, and spyware, whose names reflect the primary characteristic of the software.	The Computer Emergency Response Team In November 1988 a worm released into the Internet caused significant disruption of service.
496	MALICIOUS_SOFTWARE%WORM	MALICIOUS SOFTWARE	WORM	611	4	A worm is an autonomous program that transfers itself through a network, taking up residence in computers and forwarding copies of itself to other computers.	As in the case of a virus, a worm can be designed merely to replicate itself or to perform more extreme vandalism.	A characteristic consequence of a worm is an explosion of the worm's replicated copies that degrades the performance of legitimate applications and can ultimately overload an entire network or internet.
497	MARKUP_LANGUAGE%HYPERTEXT_MARKUP_LANGUAGE	MARKUP LANGUAGE	HYPERTEXT MARKUP LANGUAGE	433	1	Following the extensible markup language standard, notational systems called markup languages have been developed for representing mathematics, multimedia presentations, and music.	In fact, hypertext markup language is the markup language based on the extensible markup language standard that was developed for representing webpages.	Actually, the original version of hypertext markup language was developed before the extensible markup language standard was solidified, and therefore some features of hypertext markup language do not strictly conform to extensible markup language.
498	MASS_STORAGE%FILE_SERVER	MASS STORAGE	FILE SERVER	125	1	Other machines on the network then requested access to the records as they needed them.	Thus the machine that actually contained the records played the role of a server (called a file server), and the other machines played the role of clients that requested access to the files that were stored at the file server.	Today the client/server model is used extensively in network applications, as we will see later in this chapter.
499	MASS_STORAGE%MAGNETIC_DISK	MASS STORAGE	MAGNETIC DISK	123	1	Another early application of the client/server model was used to reduce the cost of magnetic disk storage while also removing the need for duplicate copies of records.	Here one machine in a network was equipped with a high-capacity mass storage system (usually a magnetic disk) that contained all of an organization's records.	Other machines on the network then requested access to the records as they needed them.
